<?xml version="1.0" encoding="UTF-8" standalone="no"?>
<adatbazis xmlns:xsi="http://www.w3.org/2001/XMLSchema-instance" xsi:noNamespaceSchemaLocation="XMLNLVHSR.xsd">
    
    <!-- RENDELÉSEK -->
        
    <rendeles id="r1">
                
        <datum>2021-10-26</datum>
                
        <fizetendo>2500</fizetendo>
                
        <vevoID>v1</vevoID>
            
    </rendeles>
        
    <rendeles id="r2">
                
        <datum>2021-10-30</datum>
                
        <fizetendo>3200</fizetendo>
                
        <vevoID>v2</vevoID>
            
    </rendeles>
          
    
    <rendeles id="r3">
            
        
        <datum>2021-11-02</datum>
            
        
        <fizetendo>1500</fizetendo>
          
        
        <vevoID>v1</vevoID>
            
    </rendeles>
                		 

    <!-- KÖNYV RENDELÉSEK -->
            	   
    
    <konyvRendeles id="kr1">
                       		      
        
        <rendelesID>r1</rendelesID>
                       		       
        
        <konyvID>k1</konyvID>
                        		       
        
        <darab>1</darab>
                       	   
    
    </konyvRendeles>
            	   
    
    <konyvRendeles id="kr2">
                        		       
        
        <rendelesID>r1</rendelesID>
                       		       
        
        <konyvID>k2</konyvID>
                       		        
        
        <darab>2</darab>
                        	    
    
    </konyvRendeles>
            		   
    
    <konyvRendeles id="kr3">
                       		       
        
        <rendelesID>r2</rendelesID>
                        		        
        
        <konyvID>k1</konyvID>
                        		        
        
        <darab>1</darab>
                           
    
    </konyvRendeles>
            	   
    
    <konyvRendeles id="kr4">
                        		       
        
        <rendelesID>r2</rendelesID>
                        		        
        
        <konyvID>k2</konyvID>
                        		        
        
        <darab>1</darab>
                       	  
    
    </konyvRendeles>
            	    
    
    <konyvRendeles id="kr5">
                       		       
        
        <rendelesID>r2</rendelesID>
                       		       
        
        <konyvID>k3</konyvID>
                        		        
        
        <darab>1</darab>
                        	   
    
    </konyvRendeles>
      
          		   
    
    <konyvRendeles id="kr6">
                        		       
        
        <rendelesID>r3</rendelesID>
                       		       
        
        <konyvID>k3</konyvID>
                       		       
        
        <darab>1</darab>
            
    </konyvRendeles>
      

    <!-- VEVŐK -->
               
    
    <vevo id="v1">
                       	       
        
        <nev>Olajos Lajos</nev>
                       	      
        
        <lakcim>1077 Budapest, Wesselényi u. 55</lakcim>
                        	       
        
        <kor>19</kor>
                       
        
        <torzsKartyaID>tk1</torzsKartyaID>
                
        
        <regisztralt>2000-01-01</regisztralt>
           
    
    </vevo>
     
      
    
    <vevo id="v2">
                       	       
        
        <nev>Varga Katalin</nev>
                       	       
        
        <lakcim>3530 Miskolc, Rácz György u. 8</lakcim>
                       	       
        
        <kor>28</kor>
                        		
        
        <torzsKartyaID>tk2</torzsKartyaID>
                
        
        <regisztralt>2012-10-12</regisztralt>
            
    </vevo>
            	

    <!-- TÖRZSKÁRTYÁK -->
    	
    <torzsKartya id="tk1">
        		
        <pontok>10</pontok>
        		
        <szintNev>Normal</szintNev>
        		
        <szintErtek>1</szintErtek>
        	
    </torzsKartya>
    	
	
    <torzsKartya id="tk2">
        		
        <pontok>3</pontok>
        		
        <szintNev>Szuper</szintNev>
        		
        <szintErtek>3</szintErtek>
        	
    </torzsKartya>
        

    <!-- KÖNYVEK -->
        
    <konyv id="k1">
                
        <szerzo>Szilasi László</szerzo>
                
        <cim>Tavaszi hadjárat</cim>
                
        <ar>5000</ar>
                
        <kotes>kemeny</kotes>
                
        <kiadoID>kia1</kiadoID>
            
    </konyv>
        
    <konyv id="k2">
                
        <szerzo>Győrffy Ákos</szerzo>
                
        <cim>A távolodásban</cim>
                
        <ar>500</ar>
                
        <kotes>puha</kotes>
                
        <kiadoID>kia1</kiadoID>
            
    </konyv>
        
    <konyv id="k3">
                
        <szerzo>Andrew S. Tanenbaum</szerzo>
                
        <szerzo>David J. Wetherall</szerzo>
                
        <cim>Számítógép-hálózatok</cim>
                
        <ar>5000</ar>
                
        <kotes>kemeny</kotes>
                
        <kiadoID>kia1</kiadoID>
            
    </konyv>
    
    <!-- KIADÓK -->
        
    <kiado id="kia1">
                
        <nev>Magvető Könyvkiadó</nev>
                
        <szekhely>Budapest</szekhely>
                
        <alapitasEve>1955</alapitasEve>
                
        <elerhetoseg>
                        
            <telefon>+36-1/323-3981</telefon>
                        
            <telefon>+36-1/235-5032</telefon>
                        
            <email>magveto.kiado@lira.hu</email>
                    
            <email>valami@gmail.com</email>
        </elerhetoseg>
            
    </kiado>
        
    <kiado id="kia2">
                
        <nev>Panem</nev>
                
        <szekhely>Budapest</szekhely>
                
        <alapitasEve>1972</alapitasEve>
                
        <elerhetoseg>
                        
            <telefon>+36-1/460-0272</telefon>
                        
            <email>webbolt@panem.hu</email>
                    
        </elerhetoseg>
            
    </kiado>
            	

</adatbazis>
